{
  "size": [
    10,
    9
  ],
  "tile_size": [
    16,
    16
  ],
  "atlas": "terrain.json",
  "tiles": [
    "grass",
    "grass",
    "grass",
    "grass",
    "grass",
    "grass",
    "grass",
    "grass",
    "grass",
    "grass",
    "grass",
    "grass",
    "grass",
    "grass",
    "grass",
    "grass",
    "grass",
    "grass",
    "grass",
    "grass",
    "grass",
    "grass",
    "grass",
    "grass",
    "grass",
    "grass",
    "grass",
    "grass",
    "grass",
    "grass",
    "grass",
    "grass",
    "grass",
    "grass",
    "grass",
    "grass",
    "grass",
    "grass",
    "grass",
    "grass",
    "grass",
    "grass",
    "grass",
    "grass",
    "grass",
    "grass",
    "grass",
    "grass",
    "grass",
    "grass",
    "grass",
    "grass",
    "grass",
    "grass",
    "grass",
    "grass",
    "grass",
    "grass",
    "grass",
    "grass",
    "grass",
    "grass",
    "grass",
    "grass",
    "grass",
    "grass",
    "grass",
    "grass",
    "grass",
    "grass",
    "grass",
    "grass",
    "grass",
    "grass",
    "grass",
    "grass",
    "grass",
    "grass",
    "grass",
    "grass",
    "grass",
    "grass",
    "grass",
    "grass",
    "grass",
    "grass",
    "grass",
    "grass",
    "grass",
    "grass"
  ]
}